"LONDON (Reuters) - Britain's departure from the European Union would threaten scientific research and jeopardize the 28-nation bloc's system of drug regulation, the European pharmaceutical industry said on Wednesday.","Brexit is the wrong prescription, says European pharma industry",Reuters Health News,2016-02-24 06:59:47 -0600
"FRANKFURT (Reuters) - Kidney dialysis provider Fresenius Medical Care (FMC) expects more than 70 percent of eligible U.S. patients to have switched to cheaper alternative anemia treatment Mircera by the end of March, the German group's chief executive said.","FMC aims for 110,000 U.S. patients to be on Mircera in first-quarter",Reuters Health News,2016-02-24 04:35:22 -0600
"LONDON,(Reuters) - Evidence is building for the theory that Zika can cause newborn brain defects and the World Health Organization is promising more answers in weeks, but nailing a definitive link will be neither simple nor swift.",Proving Zika guilty: A long and painstaking task,Reuters Health News,2016-02-24 08:34:57 -0600
"(Reuters Health) - Building exercise into lessons might help kids get better grades, especially when the task at hand requires memorization, a small Dutch study suggests.",Can kids learn more when they exercise during lessons?,Reuters Health News,2016-02-24 10:37:34 -0600
"(Reuters Health) - Marijuana is sending visitors to Colorado to hospital emergency rooms at an increasing rate, according to a new study. The same isn't true of Colorado residents, however.",Colorado visitors end up in ERs more for pot use than residents,Reuters Health News,2016-02-24 16:22:41 -0600
"VANCOUVER (Reuters) - A federal court judge in Vancouver on Wednesday ruled that medical marijuana patients have the Constitutional right to grow their own cannabis, striking down a ban introduced by Canada's previous Conservative government.",Canada patients can grow their own medical marijuana: court,Reuters Health News,2016-02-24 15:23:47 -0600
"(Reuters Health) – Mothers who share a bed with their babies are more motivated to breastfeed and more likely to keep it up for the recommended six months, according to a U.K. study.",Co-sleeping linked to breastfeeding,Reuters Health News,2016-02-24 14:45:27 -0600
"CLEVELAND (Reuters) - At least 200 students at a central Ohio public university have reported symptoms of the highly contagious norovirus, school officials said on Wednesday.",Two hundred Ohio university students sick with norovirus symptoms,Reuters Health News,2016-02-24 12:23:48 -0600
"(Reuters Health) – Serious eye problems like retinal detachment can come on suddenly and require immediate care, but few people are aware of these conditions much less how they’re treated, a small U.S. study finds.",Patient awareness of emergency eye problems is low,Reuters Health News,2016-02-24 11:44:36 -0600
"NEW YORK (Thomson Reuters Foundation) - Half of all black gay and bisexual men in the United States are projected to be diagnosed with HIV, a government study shows, in a ratio parallel to the prevalence of the virus among such men in developing nations such as Mauritania and Senegal.","Half of gay black men in U.S. likely to be diagnosed with HIV, CDC says",Reuters Health News,2016-02-24 15:55:15 -0600
(Reuters) - Johnson & Johnson was ordered by a Missouri state jury to pay $72 million of damages to the family of a woman whose death from ovarian cancer was linked to her use of the company's talc-based Baby Powder and Shower to Shower for several decades.,J&J must pay $72 million for cancer death linked to talcum powder: lawyers,Reuters Health News,2016-02-24 15:48:11 -0600
"LOS ANGELES (Reuters) - Hamburger chain In-N-Out Burger is the newest target in a push by public health, environmental and consumer groups to convince high-profile food sellers to stop serving meat from animals fed a routine diet of antibiotics.",Activists press In-N-Out on antibiotic policy amid superbug worries,Reuters Health News,2016-02-24 14:20:59 -0600
NEW YORK (Reuters) - A New York judge on Wednesday shot down a challenge by a restaurant trade group and upheld a city rule requiring many chain eateries to post warnings on menu items that are high in sodium.,Judge upholds NYC rule on restaurant salt warnings,Reuters Health News,2016-02-24 12:54:30 -0600
NEW YORK (Reuters) - Consumers expressed concern on social media about a talc-based baby powder made by Johnson & Johnson on Wednesday after a Missouri jury ordered the company to pay $72 million in damages to the family of a woman who said her death from cancer was linked to use of the product.,Social media users concerned over J&J talc powder after verdict,Reuters Health News,2016-02-24 16:00:52 -0600
"BOGOTA (Reuters) - Colombian health officials reported on Wednesday a ""probable"" case of microcephaly possibly linked to Zika, as the country closely watches potential impacts of the mosquito-borne virus.",Colombia reports 'probable' case of microcephaly in aborted fetus,Reuters Health News,2016-02-24 15:36:38 -0600
"(Reuters) - Pennsylvania Governor Tom Wolf announced on Wednesday that he has a ""treatable form"" of prostate cancer but said it would not interfere with his official duties.",Pennsylvania governor Wolf has 'treatable' prostate cancer,Reuters Health News,2016-02-24 10:41:34 -0600
"(Reuters) - A U.S. appeals court on Wednesday allowed Louisiana to enforce a restrictive 2014 abortion law critics say is aimed at shutting clinics, ending a halt to the measure handed out by a lower court judge earlier this year.",U.S. court allows Louisiana abortion restrictions to go into effect,Reuters Health News,2016-02-24 17:41:16 -0600
"NEW YORK (Thomson Reuters Foundation) - A health center operated by Medecins Sans Frontieres (MSF) has been damaged by looters in South Sudan, threatening medical care for residents of the violence-torn region, the charity said on Wednesday.",Looting of charity health center threatens medical care in South Sudan,Reuters Health News,2016-02-24 16:44:39 -0600
"WASHINGTON (Reuters) - The Senate voted overwhelmingly on Wednesday to confirm Dr. Robert Califf as head of the Food and Drug Administration, an agency that regulates everything from food and drugs to tobacco, cosmetics and dietary supplements.",Senate confirms Dr. Robert Califf to lead FDA,Reuters Health News,2016-02-24 16:30:51 -0600
"NEW YORK (Reuters) - New York City officials on Wednesday rolled out a new effort to tackle a surge in deaths from drug overdoses on Staten Island, the smallest of the city's five boroughs, which last year suffered the city's highest rate of overdose deaths.",New York steps up fight against overdoses in hard-hit Staten Island,Reuters Health News,2016-02-24 16:27:57 -0600
"SYDNEY (Reuters) - Australian authorities stepped up the fight against Zika in the north of the country on Thursday, spraying homes and businesses near a hotel after a guest tested positive for the disease and mosquitoes carrying the virus were detected.",Australian authorities spray Queensland hotel over Zika scare,Reuters Health News,2016-02-24 19:39:13 -0600
RIO DE JANEIRO (Reuters) - The head of the World Health Organization warned Wednesday that the Zika outbreak would likely worsen before nations besieged by the mosquito-borne virus linked to thousands of birth defects in Brazil see relief.,"Zika outbreak will worsen before it gets better, WHO head says",Reuters Health News,2016-02-24 19:16:22 -0600
A research team has discovered how dopamine controls the brain’s response to cocaine. Findings from this study will reveal new insights into dopamine function in the brain.,Dopamine signaling pathway that controls cocaine reward in mice identified,Science Daily Health,2016-02-24 06:05:19 -0600
"A therapy widely recommended in the UK, Europe and the US to stop babies from being born too soon is ineffective, research shows. Previous research suggested that the therapy - a hormone called progesterone - may stop pregnant women from giving birth early but little was known about its long term effects.","Therapy to stop premature birth safe but ineffective, study finds",Science Daily Health,2016-02-24 06:04:09 -0600
"Bacteria in the gut of disease-bearing insects -- including the mosquito which carries the Zika virus -- can be used as a Trojan horse to help control the insects' population, new research has shown. The results showed declines in fertility of up to 100 percent and an increase of 60 percent in the mortality rate of larvae, among the insects studied. The findings offer the prospect of a much more targeted approach to insect control.",Tackling Zika using bacteria as a Trojan horse,Science Daily Health,2016-02-24 06:04:07 -0600
"Doctors are seeing a rise in the number of parents requesting so-called 'vaginal seeding' for babies born by cesarean section, according to a new article. The practice, which is also known as microbirthing, involves taking a swab from the mother's vagina and wiping this over the baby's mouth, eyes, face and skin shortly after birth by caesarean section. The idea is that vaginal seeding allows a baby born via caesarean section to come into contact with bacteria from the birth canal. The hope is this may boost their gut bacteria, and reduce risk of conditions such as allergies or obesity.","Increased demand for 'vaginal seeding' from new parents, despite lack of evidence",Science Daily Health,2016-02-24 06:04:05 -0600
"Students would benefit from more hands-on training and responsibility, research indicates. The new findings have concluded that medical students should take on greater responsibility for patient care as undergraduates, that assessment methods in clinical practice and professionalism need improvement, and that good practice in postgraduate supervision and support must be shared.",More hands-on training for doctors required if policy changes,Science Daily Health,2016-02-24 06:04:03 -0600
"Young children will spontaneously invent tool behaviors to solve novel problems, without the help of adults, much as non-human great apes have been observed to do. The findings are contrary to the popular belief that basic tool use in humans requires social learning.",Human children and wild great apes share their tool use cognition,Science Daily Health,2016-02-24 06:01:04 -0600
"The squishiness of an hour-old fertilized egg can predict its viability, a metric that could lead to safer, more successful IVF pregnancies, a team of bioengineers and physicians has found.","'Squishiness' can indicate embryo viability, researchers find",Science Daily Health,2016-02-24 06:01:02 -0600
"For the first time, scientists have engineered new calcium receptors for the heart to tune the strength of the heartbeat in an animal model. The study showed it can enhance or therapeutically preserve heart function and cardiovascular performance in mice without harmful effects commonly seen with other agents that increase heart muscle contraction.",Scientists tune switch for contraction to fix heart disease,Science Daily Health,2016-02-24 06:00:58 -0600
"Why would a bacteria-killing protein be present in an area of the body that is not normally exposed to bacteria, like the pancreas? Researchers have puzzled over this question for some time, until they eventually discovered that the protein in question was doing something entirely unexpected -- it was actually helping the pancreas regenerate and produce insulin. This ground-breaking discovery could lead to new treatments for diabetes.",Could a bacteria-killing protein lead to a new treatment for diabetes?,Science Daily Health,2016-02-24 09:03:21 -0600
"A small regulatory RNA called microRNA-155 appears to play a key role in the brain inflammation that helps foster Parkinson’s disease. This finding, using a mouse model, implicates microRNA-155 as both a potential therapeutic target and biomarker for this progressive neurodegenerative disorder.",Regulation of Parkinson's disease inflammatory responses by a MicroRNA,Science Daily Health,2016-02-24 06:08:15 -0600
For the first time that an enzyme can be tweaked to reduce lignin in plants. Their technique could help lower the cost of converting biomass into carbon-neutral fuels to power your car and other sustainably developed bio-products.,New way to reduce plant lignin could lead to cheaper biofuels,Science Daily Health,2016-02-24 06:08:13 -0600
"Children with autism and other similar conditions often have difficulties in several areas of communication. A new doctoral thesis in linguistics shows that these children can develop speech, gestures and a sense of rhythm and melody by listening to various speech sounds.","Sounds can help develop speech, gestures in children with autism",Science Daily Health,2016-02-24 06:06:49 -0600
"A mouse study has demonstrated the potential of a special immune cell that targets a key protein in tumor growth that helps stop brain cancer. Brain cancer comes in many forms, ranging from more easily treatable benign forms that may trigger gradual loss of brain functions, to malignant forms that can in many cases prove fatal. While there have been improvements in the current standard treatments, patients with glioblastoma (GBM), the most common and aggressive form of brain tumor, still suffer from a median survival rate of only 14.6 months and 5-year overall survival rates of less than 10%.",Genetically engineered immune cell therapy found to boost survival in mice with brain tumors,Science Daily Health,2016-02-24 06:05:25 -0600
"The effects of infections on the generation of rare autoimmune diseases such as granulomatous polyangiitis (GPA), a systemic disease of the vascular system, have been examined in a new study. The central result: impaired immune response is significantly involved in these diseases.",Impaired immune response as cause of rare autoimmune diseases,Science Daily Health,2016-02-24 06:05:23 -0600
"Hiding their DNA genome inside the nucleus of the infected cells, the herpes viruses establish a lifelong infection in humans, and they are known to reactivate in response to different kinds of stress. The researchers have now found an important link between cellular stress responses, cell cycle regulation and virus reactivation.",Stress wakes up sleeping herpes viruses – but how?,Science Daily Health,2016-02-24 06:05:21 -0600
"The human brain has a remarkable defense system that filters bacteria and chemicals. For brain tumor patients, the barrier works almost too well by blocking most chemotherapy drugs.",Laser treatment may boost effectiveness of brain tumor drugs,Science Daily Health,2016-02-24 13:56:06 -0600
"An analysis of the cardiac structure and function of more than 500 National Basketball Association (NBA) players provides information that can be incorporated into clinical assessments for the prevention of cardiac emergencies in basketball players and the athletic community at large, according to a study.","Study examines heart structure, function of NBA players",Science Daily Health,2016-02-24 13:56:04 -0600
"Although cardiovascular disease risk prediction models are developed with predominantly white populations, application of models to a large black population finds that they work well in black individuals and are not easily improved on, suggesting that a unique risk calculator for black adults may not be necessary, according to a study.",Cardiovascular disease risk prediction models appear to work well in black adults,Science Daily Health,2016-02-24 13:56:02 -0600
"It's well known that genetic differences among individuals influence lifespan, but a new study suggests that differences in patterns of gene expression in youth may also predict longevity. Researchers of the shortest-lived vertebrate -- the African turquoise killifish -- found that when genes involved in a cell's energy production are less active at a young age, the animals tend to live longer.","Short-lived killifish reveals link between gene expression, longevity",Science Daily Health,2016-02-24 13:55:46 -0600
"Copies of the mouse gene R2d2 can spread quickly through lab and wild mouse populations, despite the fact that the genes cause females to have fewer offspring. This is the first time scientists have used mice to show that a selfish gene responsible for infertility can become fixed in a population.","New research challenges Darwin, shows how a gene cheats Mendel's law of segregation",Science Daily Health,2016-02-24 12:37:15 -0600
"First person shooter computer games, such as Medal of Honor, can help rehabilitate patients with Traumatic Brain Injuries, suggests new research.",Can gaming mend damaged brains?,Science Daily Health,2016-02-24 12:35:24 -0600
"Supercomputers are being used by clinicians to create 3-D models from patients with heart disease, with photos from a camera thinner than a human hair.",Cardiologists use 3-D printing to personalize treatment for heart disease,Science Daily Health,2016-02-24 12:34:51 -0600
"A new treatment for aplastic anemia is based on the transport of the telomerase gene to the bone marrow cells using gene therapy, a completely new strategy in the treatment of aplastic anemia.",Researchers fight aplastic anemia using a therapy designed to delay ageing,Science Daily Health,2016-02-24 12:34:19 -0600
"Conservatives prefer using nouns, new transatlantic research suggests. The research also established that conservatives generally, to a greater degree than liberals, tend to refer to things by their names, rather than describing them in terms of their features. An example would be saying someone 'is an optimist', rather than 'is optimistic'.","Conservatives prefer using nouns, new research finds",Science Daily Health,2016-02-24 12:34:17 -0600
"Computers are able to read a person's body language to tell whether they are bored or interested in what they see on the screen. The research shows that by measuring a person's movements as they use a computer, it is possible to judge their level of interest by monitoring whether they display the tiny movements that people usually constantly exhibit, known as non-instrumental movements.","Computers can tell if you're bored, shows new study",Science Daily Health,2016-02-24 12:34:11 -0600
"An innovative means of investigating membrane proteins produced by a pair of highly pathogenic organisms has been the focus of recent study. The research team showed that DNA-based genetic immunization, using a device known as a gene gun, could successfully express membrane proteins in mice and induce the animals to produce a range of critical antibodies to bacterial and viral targets.",Simpler technique yields antibodies to a range of infectious agents,Science Daily Health,2016-02-24 12:29:33 -0600
"You won't make big cuts in your environmental impact by taking shorter showers or turning out the lights. The real environmental problem, a new analysis has shown, is embodied in the things you buy.",Consumers have huge environmental impact,Science Daily Health,2016-02-24 12:29:23 -0600
"Genetic counseling helps patients with schizophrenia, bipolar disorder and similar conditions understand and cope with their illness, a new study concludes. The study is among the first to show the value of genetic counseling for psychiatric illnesses, and researchers say that the service should be made more available to people suffering from mental illness.","Genetic counseling helps psychiatric patients, study shows",Science Daily Health,2016-02-24 14:08:52 -0600
"Stratospheric costs for therapies not yet covered by insurance put some drugs out of reach for many patients. This study shows how securitized consumer health-care loans could spread the cost of therapies over many years, giving more patients access to drugs while generating returns to investors.","Financial engineering could make life-saving drugs more available, affordable",Science Daily Health,2016-02-24 14:07:29 -0600
The recent outbreak of Zika virus disease and its link to fetal development highlights the need for pregnant women and those of reproductive age to be a priority group for developing and evaluating new vaccines and vaccine guidelines for Zika and other emerging infectious diseases.,Zika epidemic highlights need for priority vaccine research for pregnant women,Science Daily Health,2016-02-24 14:07:27 -0600
"Can we learn to live with--rather than kill--cancer? A new study suggests that frequent, low-dose chemotherapy that keeps tumor growth under control may be more effective than standard high-dose chemotherapy that seeks to eradicate cancer cells completely.",Unconventional treatment strategy controls -- rather than eradicates -- cancer,Science Daily Health,2016-02-24 13:56:08 -0600
"Researchers have created a new kind of laser capable of pulsed and continuous mid-infrared (IR) emission between 3.1 and 3.2 microns, a spectral range that has long presented a major challenge for laser developers. The achievement could aid in the development of new uses for mid-IR lasers, which are currently used in applications such as spectroscopy, environmental sensing and detecting explosives.",New laser achieves wavelength long sought by laser developers,Science Daily Health,2016-02-24 12:29:14 -0600
"Omega-3 fatty acids may lower the risk of breast cancer in postmenopausal obese women, according to researchers. The protection likely comes from the fatty acids' anti-inflammatory effects, say authors.",Omega-3 fatty acids may lower breast cancer risk in postmenopausal obese women,Science Daily Health,2016-02-24 09:10:25 -0600
"A new study reports that adolescents with major depression who performed a computer-based task designed to shift attention from sad to neutral to positive word associations showed reductions in negative attention biases and clinician-rated depressive symptoms. 11% of American adolescents suffer from Major Depressive Disorder (MDD). Facing a broad range of psychosocial and health problems, these youths are five times more at risk to attempt suicide than peers without psychiatric illness.",Attention bias modification treatment in depressed adolescents,Science Daily Health,2016-02-24 09:05:50 -0600
"Children with fetal alcohol spectrum disorders are affected by a range of problems, including anxiety, depression, aggression, delinquency and diminished learning capacity a new review of evidence reveals.",Research pinpoints devastating impacts of fetal alcohol syndrome,Science Daily Health,2016-02-24 09:03:27 -0600
"Sophisticated prenatal techniques, not yet in clinical practice, offer the potential to prevent a cruel multi-system genetic disease passing from mother to child long before birth. But emerging mitochondrial replacement techniques (MRTs) raise ethical and social questions about potential risks and consequences for patients, families and clinicians.",What will emerging genetic tools for mitochondrial DNA replacement mean for patients?,Science Daily Health,2016-02-24 21:31:15 -0600
"Out-of-towners using marijuana in Colorado -- which has legally allowed sales of the drug in retail dispensaries since 2014 -- are ending up in the emergency room for marijuana-related symptoms at an increasing rate, reports a new study. Visitors are unprepared for the adverse effects of marijuana use. The study shows the importance of educating the public about safe marijuana use.",Colorado visitors using marijuana more likely to end up in emergency room,Science Daily Health,2016-02-24 21:31:04 -0600
"People with diabetes often have high blood pressure and an increased cardiovascular risk. They are therefore often recommended more intensive blood pressure lowering treatment that non-diabetics. However, for patients with systolic blood pressure levels under 140, antihypertensive drugs may increase the risk of dying from cardiovascular causes.",Intensive blood pressure lowering treatment may harm people with diabetes,Science Daily Health,2016-02-24 21:31:01 -0600
A recent study found that gamers using thin avatars showed increased physical activity compared to those using obese avatars.,Using thin or obese avatars in motion-controlled gaming can influence physical activity,Science Daily Health,2016-02-24 15:44:03 -0600
A new study has found that differences in an individual's working memory capacity correlate with the brain's ability to actively ignore distraction.,Inability to avoid visual distractions linked to poor short-term memory,Science Daily Health,2016-02-24 15:44:01 -0600
"Many patients develop resistance to standard therapies and eventually relapse. Now researchers hope to improve treatment outcomes with development of a novel therapeutic strategy, called adaptive therapy, which is based on evolutionary principals and aims to keep resistant cells in check by maintaining a population of chemo-sensitive cells.",Novel cancer treatment developed to inhibit chemo-resistance,Science Daily Health,2016-02-24 15:43:57 -0600
"Scientists have found evidence that some carbon nanomaterials can enter into immune cell membranes, seemingly going undetected by the cell's built-in mechanisms for engulfing and disposing of foreign material, and then escape through some unidentified pathway.",Immune cells don't always ward off carbon nano invaders,Science Daily Health,2016-02-24 14:14:02 -0600
"Students who attend school in buildings specifically designed to be 'green' exhibit higher levels of knowledge about energy efficiency and environmentally friendly building practices, a new study shows.",School buildings designed as 'teaching green' can lead to better environmental education,Science Daily Health,2016-02-24 14:14:00 -0600
