"Through monthly monitoring and support from pain specialists, primary care physicians confidence in prescribing opioids for pain was raised, the rate of identifying patients at risk for misuse of opioids was improved, and primary care physicians were more likely to feel satisfied about their communications with pain specialists, a report shows. The patients reported greater compliance with their opioid medications.","Monitoring, support help patients, primary care physicians dealing with chronic pain",Science Daily Health,2016-02-24 14:10:19 -0600
"For the small segment of the emergency population whose acute behavioral disturbance does not respond to traditional sedation, ketamine appears to be effective and safe, according to a new study.",Ketamine for the difficult-to-sedate ER patient,Science Daily Health,2016-02-24 14:10:11 -0600
"NCAA athletes need more coaching on the long odds of playing professionally and the importance of academics to their future success, according to a new study.","NCAA athletes need more coaching on academics, career options",Science Daily Health,2016-02-24 14:09:04 -0600
"A study on the genetics of pancreatic cancer reveals that it is actually four separate diseases, with different genetic triggers and survival rates, paving the way for more accurate diagnoses and treatments.","Pancreatic cancer is four diseases, each with new treatment possibilities",Science Daily Health,2016-02-24 14:08:58 -0600
"Forget intelligence or wisdom. A muscular physique might just be a more important attribute when it comes to judging a person's leadership potential, according to a new study.",Want to be seen as a leader? Get some muscle,Science Daily Health,2016-02-24 15:43:49 -0600
"People who keep mentally and physically healthy in middle age may help stave off the symptoms of Alzheimer's disease, but the activity does not affect the underlying disease changes in the brain for most people, according to a new study.","Keeping mind active may delay symptoms of Alzheimer's, but not underlying disease",Science Daily Health,2016-02-24 15:43:45 -0600
"In the midst of the 2016 presidential election season, headlines often tell the story of a polarized political climate in America. However, a recent national survey has found overwhelming bipartisan support for parks and recreation.","In polarized political climate, study finds common ground",Science Daily Health,2016-02-24 14:18:36 -0600
"Researchers investigated differences in care given to chronic obstructive pulmonary disease patients by medical doctors compared with nurse practitioners and physician assistants, and report their findings in a new article.",How does COPD care by physicians compare with nurse practitioners/physician assistants?,Science Daily Health,2016-02-24 14:14:47 -0600
"Most of the 82 Ebola survivors in a new study from the world's largest Ebola outbreak had brain symptoms more than six months after the initial infection. The study is part of the larger Prevail III study, which follows patients with prior Ebola virus disease and their close contacts who serve as study controls.",Most Ebola survivors examined in study experienced brain symptoms six months after infection,Science Daily Health,2016-02-24 21:34:25 -0600
They're not always the same as in men,Health Tip: Women May Have Unique Heart Disease Symptoms,US News Health,2016-02-24 06:00:00 -0600
Suggestions to avoid being a couch potato,Health Tip: Getting More Active at Home,US News Health,2016-02-24 06:00:00 -0600
Radon exposure is a known risk factor for lung cancer.,Does Your Home or Building Need Radon Testing?,US News Health,2016-02-24 09:04:37 -0600
"Here’s why you should
become an advocate, too.",Why I Became an Advocate for People With Chronic Disease,US News Health,2016-02-24 08:43:41 -0600
Dutch study also found bringing exercise to the classroom boosted spelling grades,Exercise &#43; Classwork May &#61; Better Math Scores,US News Health,2016-02-24 08:00:00 -0600
 Senate Confirms Califf to Lead FDA Judge Okays Fines for NYC Restaurants That Don't Post Salt Warnings Jury Awards $72 Million in Johnson &amp; Johnson Baby Powder Case Alfalfa Sprouts Likely Cause of Salmonella Outbreak: CDC ,"Health Highlights: Feb. 24, 2016",US News Health,2016-02-24 07:16:00 -0600
Small study found half of patients still getting pain relief a year out from treatment,Nerve Block Technique Might Help Ease Chronic Back Pain,US News Health,2016-02-24 06:00:00 -0600
"HAVANA (AP) — Olive-clad soldiers are going door-to-door across Cuba, filling houses with mosquito-killing fog in a nationwide mobilization to keep the Zika virus out of one of the last countries in the hemisphere without it.",Cuba throws soldiers into battle against Zika virus,US News Health,2016-02-24 09:23:02 -0600
"Introducing the 'grossly underfunded' study of how to live well with, and hopefully beyond, cancer.&nbsp;",Cure Isn't Enough: The Epic Misconception of 'Cancer Research',US News Health,2016-02-24 09:28:21 -0600
"The practice can put a child at risk for serious infections, researchers warn.",Vaginal Seeding Could Be Risky,US News Health,2016-02-24 12:14:34 -0600
But Norwegian researchers also found no increased risk of birth defects or delivery complications,"Male Childhood Cancer Survivors Less Likely to Have Kids, Study Finds",US News Health,2016-02-24 11:00:00 -0600
Researchers have been warning us for years.,Zika Spread Worsened by Climate Change,US News Health,2016-02-24 10:27:44 -0600
"DENVER (AP) — Colorado's tourists aren't just buying weed now that it's legal — they're ending up in emergency rooms at rates far higher than residents, according to a new study.",Study: Tourist pot complaints up at Colorado emergency rooms,US News Health,2016-02-24 16:01:39 -0600
"Many out-of-state users overindulge with marijuana, particularly the edible version, researcher says",'Pot Tourists' Linked to Surge in Colorado ER Visits,US News Health,2016-02-24 16:00:00 -0600
"OXFORD, Ohio (AP) — Miami University of Ohio says some 200 students have been sickened in a norovirus outbreak.",200 students at Miami University of Ohio sick from norovirus,US News Health,2016-02-24 15:12:27 -0600
"Six months after active illness, headaches, memory loss, depression were still being reported",Ebola May Leave Lasting Neurological Problems,US News Health,2016-02-24 15:00:00 -0600
"WASHINGTON (AP) — The late Supreme Court Justice Antonin Scalia's voluminous public information file is remarkably short on any details related to his health, just a report of minor shoulder surgery in 2003.",Report: Sheriff was told he had no authority in Scalia death,US News Health,2016-02-24 14:52:49 -0600
Following medical protocol after cardiac arrest reduces the likelihood of brain damage or even death.,Study: Some Hospitals Are Better at Reacting to Cardiac Arrest Than Others,US News Health,2016-02-24 14:14:47 -0600
NEW YORK (AP) — The flu vaccine is doing a better job this year.,Flu vaccine more effective this year; milder season so far,US News Health,2016-02-24 14:06:39 -0600
"ALBANY, N.Y. (AP) — An upstate New York mayor's proposal to consider allowing heroin users to shoot up under medical supervision has divided drug policy experts, with some hailing it as an innovative, science-based approach and others rejecting it as radical and a slippery slope to legalization.",NY mayor's call for heroin injection site divides experts,US News Health,2016-02-24 13:56:14 -0600
"Findings on differences in structure, function may offer clues to high rates of cardiac arrest among these elite athletes",NBA Players Putting Their Hearts Into Medical Research,US News Health,2016-02-24 13:00:00 -0600
"Study suggests that, for most people, this kind of lifestyle does not curb markers of disease in the brain","Active Mind, Body May Only Do So Much Against Alzheimer's",US News Health,2016-02-24 13:00:00 -0600
"Both produced high levels of antibodies to the deadly virus, researchers say",2 Experimental Ebola Vaccines Show Potential,US News Health,2016-02-24 13:00:00 -0600
"But types of tumors start to vary as people age, researchers add","Brain Cancers Both Common and Deadly Among Teens, Young Adults: Report",US News Health,2016-02-24 13:00:00 -0600
"Cancer-fighting drugs were able to reach tumors, but the technique still in preliminary stage","Laser Unlocks Blood-Brain Barrier for Chemotherapy, Study Shows",US News Health,2016-02-24 13:00:00 -0600
"Researchers find falls, broken bones, bed sores more likely in older patients",Health Problems Can Plague Seniors After Cancer Surgery,US News Health,2016-02-24 13:00:00 -0600
WASHINGTON (AP) — The Senate has confirmed President Barack Obama's nominee to be commissioner of the Food and Drug Administration.,Senate confirms Robert Califf as head of FDA,US News Health,2016-02-24 12:28:19 -0600
" U.S. Supreme Court justice Antonin Scalia was known for the exacting style of his opinions, the way he labored over each and every word. His hotel room the night of his death reflected this obsession with detail. According to a sheriff's report obtained by The Washington Post this week, he was lying in bed with ...",Scalia may have forgotten to hook himself up to sleep apnea machine. Why that can be dangerous.,Wash. Post Health,2016-02-24 10:58:16 -0600
" U.S. Supreme Court justice Antonin Scalia was known for the exacting style of his opinions, the way he labored over each and every word. His hotel room the night of his death on Feb. 13 in Texas reflected this obsession with detail. According to a sheriff's report obtained by The Washington Post this week, he ...",Did Justice Scalia die from sleep apnea? Questions raised by his unplugged breathing machine.,Wash. Post Health,2016-02-24 10:58:16 -0600
" Senate lawmakers voted overwhelmingly Wednesday to confirm Robert Califf, a longtime cardiologist and academic researcher, as the next commissioner of the Food and Drug Administration. The final tally was 89 to 4. ""Dr. Califf is the right person with the right experience to build on the FDA’s unsurpassed record of protecting public health while encouraging ...",Senate confirms Robert Califf as new FDA commissioner,Wash. Post Health,2016-02-24 16:27:52 -0600
" U.S. Supreme Court justice Antonin Scalia was known for the exacting style of his opinions, the way he labored over each and every word. His hotel room the night of his death on Feb. 13 in Texas reflected this obsession with detail. According to a sheriff's report obtained by The Washington Post this week, he ...",Did sleep apnea contribute to Justice Scalia’s death? His unplugged breathing machine raises that question.,Wash. Post Health,2016-02-24 10:58:16 -0600
" Researchers in Houston have announced that they have developed the first hospital-based, rapid diagnostic test for Zika, an advance that they said should help public health officials identify if -- or, more likely, when -- infected mosquitoes reach the United States this summer. Using a sample of a patient's blood, urine, spinal fluid or amniotic fluid for pregnant women, the ...",Texas hospitals announce first quick test for Zika that could help identify when the virus reaches U.S.,Wash. Post Health,2016-02-24 09:12:46 -0600
" The next time you send a tweet about electronic cigarettes, you might unwittingly be taking part in a clinical study examining what Americans are saying online about vaping. Researchers at NYU Langone Medical Center recently analyzed 28 million tweets containing hashtags like #vape, #ecigs and #ejuice to build a monitoring tool that tracks who is ...",Someone is tracking how much you ‘vape’ on Twitter,Wash. Post Health,2016-02-24 08:00:35 -0600
